{
  "version": 2,
  "model": "FaroValidation",
  "stage": "discovery",
  "verification_status": "verified",
  "goal": "Determinar o que Faro é fisicamente e quais responsabilidades podem ser contratadas sem assumir função por nome.",
  "depends_on": [],
  "requirements": [
    {
      "id": "FARO-R01",
      "statement": "Identificar hostname, SO, arquitetura, CPU, RAM, disco, interfaces, IPs e serviços existentes.",
      "source": "contratos/node.schema.json",
      "mandatory": true,
      "evidence": "Host faro: Ubuntu 26.04 KVM x86_64; DMI QEMU 8 GB RAM e MemTotal guest 7.785.426.944 bytes; 2 vCPU; disco 200 GiB; LV 198G; rede 10.62.91.5; inventário residente errors=0 warnings=0."
    },
    {
      "id": "FARO-R02",
      "statement": "Determinar role somente após inventário; valores permitidos continuam control, forja, edge ou other.",
      "source": "contratos/node.schema.json",
      "mandatory": true,
      "evidence": "Role edge confirmada pelo perfil CloudIFF e observada no heartbeat PostgreSQL."
    },
    {
      "id": "FARO-R03",
      "statement": "Declarar capabilities somente quando forem observáveis e necessárias à função escolhida.",
      "source": "contratos/node.schema.json",
      "mandatory": true,
      "evidence": "Capabilities observadas: inventory, health, telemetry-host, agent-auto-update; portal-host permanece desejada e ainda não observada."
    }
  ],
  "tasks": [
    {
      "id": "FARO-T01",
      "action": "Coletar inventário de hardware, sistema, interfaces, rotas e serviços sem alterar configuração.",
      "expected_result": "baseline físico e lógico de Faro",
      "gate": "passed:inventario-host-real"
    },
    {
      "id": "FARO-T02",
      "action": "Classificar role e capabilities a partir do inventário e da função desejada pelo operador.",
      "expected_result": "role/capabilities deixam de ser unresolved somente com decisão explícita",
      "gate": "passed:role-edge-capabilities-observadas"
    },
    {
      "id": "FARO-T03",
      "action": "Registrar conflitos com serviços existentes, portas ocupadas e restrições de manutenção.",
      "expected_result": "mapa de coexistência antes de qualquer deploy",
      "gate": "passed:listeners-baseline-ssh-only"
    }
  ],
  "distributed_system_checks": {
    "identity_independence": "Faro deve possuir node_id e credenciais próprios; nenhuma identidade é herdada de outro host.",
    "trust_boundary": "Cada salto de rede/autenticação precisa de allowlist e identidade verificável; rede não é assumida confiável.",
    "idempotency": "Reenvio de heartbeat e repetição de bootstrap/verificação não podem criar node duplicado nem efeitos divergentes.",
    "partial_failure": "Falhas de rede, NATS, certificado, agent ou control-plane devem degradar de modo observável e recuperável.",
    "observability": "Toda transição relevante precisa produzir health, observed_at, audit/evento ou evidência mecânica equivalente.",
    "reconciliation": "Desired e observed state devem convergir por revisão explícita; divergência deve resultar em noop/reconcile/blocked/degraded/failed."
  },
  "decisions": [
    {
      "name": "role",
      "status": "fixed",
      "allowed_values": [
        "edge"
      ],
      "rule": "role edge confirmada pelo operador/projeto e observada no heartbeat"
    },
    {
      "name": "capabilities",
      "status": "derived",
      "allowed_values": [
        "inventory",
        "health",
        "telemetry-host",
        "agent-auto-update"
      ],
      "rule": "somente capabilities observadas no heartbeat atual; portal-host ainda não observada"
    },
    {
      "name": "network_address",
      "status": "fixed",
      "allowed_values": [
        "10.62.91.5"
      ],
      "rule": "endereço reservado pelo operador para VM ou máquina física via VPN"
    },
    {
      "name": "form_factor",
      "status": "fixed",
      "allowed_values": [
        "virtual-machine-kvm"
      ],
      "rule": "systemd-detect-virt=kvm no host definitivo 10.62.91.5"
    }
  ]
}
