{
  "version": 2,
  "model": "FaroValidation",
  "stage": "acceptance",
  "verification_status": "verified",
  "goal": "Consolidar os portões de Faro sem marcar nenhum requisito como aprovado antes de evidência mecânica do host.",
  "depends_on": [
    "reconciliation-resilience"
  ],
  "requirements": [
    {
      "id": "FARO-R18",
      "statement": "Todos os requisitos obrigatórios R01-R17 precisam de evidência mecânica antes do aceite de Faro.",
      "source": "P06/Faro v30",
      "mandatory": true,
      "evidence": "PASS: R01-R17 possuem evidência mecânica; R14 permanece fechada por docs/reconciliation/faro-r14-v42.json; em 2026-08-26 o runtime observa 4 vCPU online e o PostgreSQL confirma node_count=1, cpu_count=4 e heartbeat corrente."
    },
    {
      "id": "FARO-R19",
      "statement": "Nenhum segredo, token, chave privada ou capability temporária pode aparecer em evidência ou diagrama.",
      "source": "política CloudIFF",
      "mandatory": true,
      "evidence": "PASS em 2026-08-26: staged diff da unidade faro-cloudiff-release sem token/senha/chave privada; nenhuma private key adicionada; credenciais runtime permanecem fora do repositório."
    },
    {
      "id": "FARO-R20",
      "statement": "Rollback ou remoção do agent deve preservar serviços pré-existentes do host.",
      "source": "cloud-design-patterns: compensating/rollback",
      "mandatory": true,
      "evidence": "Rollback controlado parou agent/updater; SSH, resolved e networkd permaneceram active, failed units=0; reapply recuperou heartbeat com node_count=1."
    },
    {
      "id": "FARO-R21",
      "statement": "Faro deve operar com endereço 10.62.91.5 e seu heartbeat não pode depender de Forja ou Maurício no caminho crítico.",
      "source": "contratos/faro-node-preparation.schema.json",
      "mandatory": true,
      "evidence": "Faro usa 10.62.91.5 e publica diretamente para 10.62.92.7:14222 via gateway 10.62.91.1; heartbeat não depende de Forja/Maurício."
    }
  ],
  "tasks": [
    {
      "id": "FARO-T17",
      "action": "Consolidar inventário, rede, PKI, NATS, agent, heartbeat, reconciliação e resiliência em uma matriz final.",
      "expected_result": "cada gate marcado passed/failed/not_verified com evidência",
      "gate": "passed:R01-R17-mechanical-evidence"
    },
    {
      "id": "FARO-T18",
      "action": "Executar rollback do onboarding ou desativação controlada do agent sem remover serviços legados.",
      "expected_result": "host retorna ao baseline CloudIFF sem dano colateral",
      "gate": "passed:disable-reapply-preserves-host-services"
    },
    {
      "id": "FARO-T19",
      "action": "Somente após todos os gates obrigatórios, propor aceite do node Faro e eventual role/capabilities definitivos.",
      "expected_result": "aceite é consequência de evidência, não de intenção",
      "gate": "passed:faro-node-accepted-resource-gates-pass"
    }
  ],
  "distributed_system_checks": {
    "identity_independence": "Faro deve possuir node_id e credenciais próprios; nenhuma identidade é herdada de outro host.",
    "trust_boundary": "Cada salto de rede/autenticação precisa de allowlist e identidade verificável; rede não é assumida confiável.",
    "idempotency": "Reenvio de heartbeat e repetição de bootstrap/verificação não podem criar node duplicado nem efeitos divergentes.",
    "partial_failure": "Falhas de rede, NATS, certificado, agent ou control-plane devem degradar de modo observável e recuperável.",
    "observability": "Toda transição relevante precisa produzir health, observed_at, audit/evento ou evidência mecânica equivalente.",
    "reconciliation": "Desired e observed state devem convergir por revisão explícita; divergência deve resultar em noop/reconcile/blocked/degraded/failed."
  },
  "decisions": []
}
